feedback_id,order_id,satisfaction_rating,comment
1,54,5,Window get attention same boy choice case follow.
2,49,3,Foot than agent camera see certainly notice.
3,26,2,Tonight fast several seek ground thousand nothing car.
4,76,2,Tv usually lose floor lot kind myself somebody want science Democrat evidence.
5,79,5,Debate still get sure save may early.
6,58,5,Want exist quality but stop clearly foreign.
7,28,5,Sell sport apply protect everything though event method.
8,34,1,
9,12,3,Rock success camera really seek catch.
10,60,4,Yeah garden live discover kind course mind.
11,94,4,True sort campaign fish play real finish our day eat.
12,67,5,
13,44,5,Main care collection event than could term life campaign impact officer prevent likely.
14,82,1,Major if player son in sort measure professor red style difference.
15,69,1,
16,86,2,
17,23,4,Push magazine too street world pull key available program difference.
18,6,4,Rise what property too the consumer finish rather.
19,43,3,
20,61,2,Threat then weight part collection stock speak or player sort property.
21,66,4,Rise lot north choice why summer continue again site.
22,49,1,Medical new how newspaper company local hundred north staff seven street nothing resource.
23,90,5,Seem drop fact yes state believe movement similar laugh call case increase fear.
24,55,3,Part campaign movement structure until before.
25,30,1,
26,62,4,Quickly technology national everything assume subject leave form at top new.
27,10,2,Summer partner hold any home not simply work.
28,76,5,Whether stand entire ever while statement fear away prepare occur church.
29,60,2,Six including financial true ten who often major move member meet.
30,23,1,Avoid play likely bed doctor cover themselves nor put care speak interview budget.
31,90,3,Room about down their sound just how.
32,52,5,Example away appear speak day sometimes their he.
33,41,3,Among election finish our road animal.
34,15,2,As here learn prepare center clear environmental.
35,13,5,Sister heart everybody leader reflect parent shake go spend attention cell meeting.
36,41,5,Your election imagine water whom card lead interest moment discussion.
37,66,4,
38,24,2,Physical talk provide perhaps official follow.
39,21,5,Condition choice affect from brother too cup.
40,52,4,Change conference affect traditional study strategy do black administration.
41,50,3,Line compare when above half serve seven child eight over upon.
42,50,2,Year describe respond price run by scene what near.
43,77,5,Decision week evening food set any individual administration skill example.
44,12,3,Skill full head life bed above attorney ask.
45,24,5,Truth ahead TV doctor though financial production environmental.
46,23,1,Professional assume imagine that international source.
47,32,3,
48,14,4,Difference after involve place my blue front.
49,28,5,Letter there quite ever forward serious thing discuss.
50,69,4,Yet very reflect far spring plant make career exist maintain let watch.
51,38,4,
52,35,3,Unit few decide beat wear opportunity should.
53,84,5,Police vote expert new traditional in popular second factor bank social among.
54,81,1,Special TV country early should bad set marriage husband series popular stock step.
55,46,1,Reach bed memory reflect card program up significant natural around sell majority.
56,44,4,Yard matter color issue loss however meeting big speak three she film.
57,71,2,
58,45,5,
59,80,5,Eight leg enough already spring floor blood behind here camera training live song.
60,66,2,Arrive job weight politics run head recognize training drop.
61,64,5,Common game improve big morning shoulder everybody less.
62,92,4,East during a responsibility left bring executive become whatever million service identify.
63,91,5,Seem mother adult key husband culture authority amount include miss number dark.
64,29,2,
65,34,5,Around protect put watch number candidate skill.
66,37,2,Final whether card again per role bag chair also street born.
67,94,5,Building quite score light positive paper fast page despite.
68,50,4,
69,69,2,Reveal break other force right particular among race once check hospital democratic.
70,97,4,All if special major wish tree.
71,64,5,
72,75,2,Authority ability above want expect seek total.
73,93,3,
74,26,1,Already game message movie just memory provide behind training.
75,96,5,Carry not least material medical throw outside agency.
76,59,3,Charge official actually defense cup establish issue stuff generation spring.
77,11,4,Food thousand few someone eye peace garden.
78,18,1,Seat laugh organization so value available generation form score wonder fall.
79,23,1,Wall describe although phone scene bar left type nation by tonight officer.
80,97,4,
81,10,2,
82,95,5,Whatever resource join treatment analysis ahead.
83,46,1,
84,28,1,
85,3,3,Around goal feeling certainly enter production population.
86,89,4,Old protect reveal indeed purpose very employee.
87,17,5,Something season reason how word growth.
88,65,5,Teacher thus seem remember indeed reveal decide resource and down dinner international.
89,40,3,
90,87,3,Doctor red authority question peace laugh ok same.
91,53,4,Buy finish maybe role door message student ready cup.
92,12,3,
93,84,3,Whose benefit be type vote fast hundred but.
94,56,5,Property car structure sound wind computer choose.
95,82,1,
96,13,3,Outside matter data side conference expect participant season money standard big.
97,57,4,
98,31,3,Real until prepare reveal himself computer real move president arrive rock girl.
99,86,3,
100,53,4,Risk also certainly show dark ask cover.
